<?xml version='1.0' standalone='no' ?>
<!DOCTYPE histogram SYSTEM 'q5.dtd'>
<histogram><skill name="SQL"><count level="1" n="0"/><count level="2" n="0"/><count level="3" n="0"/><count level="4" n="0"/><count level="5" n="2"/></skill><skill name="Scheme"><count level="1" n="0"/><count level="2" n="0"/><count level="3" n="0"/><count level="4" n="0"/><count level="5" n="2"/></skill></histogram>
